product_name,review_title,rating,pros,cons,full_content,page_number
Jira,"Great for agile teams and development work coordination, but reporting could use some work",N/A,"Fits right into agile methodology and very easy to use.No problems with copy/pasting images, attachments, and formatting stories to look right. Interface is fast, pleasing to use.Commenting and tracking conversation and notes on stories is very easy.","Reporting and some charting capabilities is lacking. Need better ways to track burndown, velocity, etc.Missing functionality for tracking testing and pass/fail.A good example of ""you get what you put in"". It can get messy and overwhelming easily if left unchecked. Some tools and study on this would be helpful to guide users on proper management of agile.","Great for agile teams and development work coordination, but reporting could use some workRating: 9 out of 10IncentivizedJanuary 19, 2018Use Cases and Deployment Scope[It's being used for] Coordinating work and submissions from multiple stakeholders and users and estimating completion of projects. M...",16
Jira,JIRA - helps you implement agile SDLC cycles effectively.,N/A,"It helps in Release Management in our rapid release cycles. sync with Product Management tool and Customer support tools.Supports various kind Of Agile models like scrum & KanbanUser accesses, custom story types, Workflow support to automate development cycle.",I think they can improve on reporting capabilities to get more insights about developer productivity.Documentation attached to each story is not readable for non-developer teams. If features were better readable UI/UX for business users will help to get all stakeholders in product process to start using JIRA,"JIRA - helps you implement agile SDLC cycles effectively.Rating: 9 out of 10IncentivizedJanuary 15, 2018Use Cases and Deployment ScopeCurrently, our Product team, development teams, QA &amp; Customer support teams are using JIRA to manage Development, Production defects, Release cycles. We are using...",16
Jira,JIRA - Highly recommend for anyone wanting to better organize their tasks,N/A,Tracking of current projects for large teamsTime managementData gathering for developing workflow procedures and expectations,Sorting of attachments in individual tickets,"JIRA - Highly recommend for anyone wanting to better organize their tasksRating: 10 out of 10IncentivizedJanuary 12, 2018Use Cases and Deployment ScopeJIRA is currently being used across our marketing department. We use it for task management activities as well as tracking time used for particular t...",16
Jira,Great for what we need,N/A,"Its ability to generate reports and dashboards that are accessible, usable and understandable to C-Suite executivesIts ability to integrate with other tools through the use of plugins and add-ons (including source code repositories, a big one for use)Its ease of use - new hires don't generally need to be trained at all, they pick up the right way to use the tool within their first week",,"Great for what we needRating: 8 out of 10IncentivizedDecember 28, 2017Use Cases and Deployment ScopeWe use JIRA to track defects, and the resolution of those defects, across hardware and software platforms. 95% of the engineering organization uses it in one way or another, although the use cases dif...",16
Jira,JIRA is huge but it pays off,N/A,"JIRA is an excellent tool to connect different teams and work styles in an efficient way, without being too specific for some of them.It has a lot of features and settings to offer which really enable you to plan a task in a very detailed way.Thanks to the different conditions of a task, the status can be tracked easily and everyone always knows who's the one who has to provide input.","JIRA is not the right tool for people who are looking for an easy, small and quick to learn project management tool.There should be more options to layout a task in terms of tables, image integration et cetera. Currently, the bigger a tasks gets, the more complicated and difficult to understand it looks.","JIRA is huge but it pays offRating: 7 out of 10IncentivizedDecember 28, 2017Use Cases and Deployment ScopeWe're using JIRA as a communication and project management tool between our IT and other departments, like management, design, sales and so on. Basically every employee with project management t...",16
Jira,Rich with Features and Complexity,N/A,It's great for holding all our projects and tickets with teams assigned.It has good features for formatting ticket descriptions and comments for team collaboration.I like the hours tracking feature because it's easy to enter hours for each ticket and also see all my time for the week at a glance.,Better formatting options in tickets.Apply UX principles for easier workflow and UI.More options to simplify and cut out unnecessary features that we don't use.,"Rich with Features and ComplexityRating: 7 out of 10IncentivizedDecember 22, 2017Use Cases and Deployment ScopeWe use Jira across our whole organization to track one-time and ongoing projects as well as employee time. We use it to track epics, stories, tasks, features, defects and hours spent. We us...",16
Jira,Jira Review,N/A,"It has a lot of flexibility in the way you can create swimlanes, flag cards, and move things around on the board.Easy to track and follow your team's progress and see if you are getting things done according to schedule.The circles that represent the days along the bottom of each card are nice so that you can see if anything is getting stale.","It needs a better way to auto refresh. Having to refresh the page sometimes can be frustrating.Sometimes it's very slow to reflect that you are dragging things between columns, and before you know it you have grabbed the wrong card.","Jira ReviewRating: 10 out of 10IncentivizedDecember 13, 2017Use Cases and Deployment ScopeWe use Jira to facilitate agile programming. We have boards that we use for different products and [it] allows us each to pick up tasks to work on and allows others to see what is happening across the group.Pro...",16
Jira,Vast customization options. If used correctly can facilitate process improvements.,N/A,Allows us to customize our board to match the teams' workflows and not the other way around.Allows transparency to management and other interested parties.If used appropriately it can help cut down on process bloat.,It can be complicated to set up and manage. Depending on the size of your organization it could require a full time administrator to manage.,"Vast customization options. If used correctly can facilitate process improvements.Rating: 9 out of 10IncentivizedDecember 1, 2017Use Cases and Deployment ScopeWe use JIRA in many different implementations across our organization. We've customized boards for teams in our department to match their ind...",16
Jira,Review On Jira,N/A,The release engineer team uses the details of components that are to be deployedThe performance team uses the tasks that have to be tested under loadThe network team implements i-rules and and firewall requests etc.,It needs more robustnessCross platform portabilityMore user-friendly,"Review On JiraRating: 8 out of 10IncentivizedNovember 22, 2017Use Cases and Deployment ScopeWe use jira extensively within the team as well as other teams. Particularly it's a bridge between the dev team, release team, network team and database teams and many more.It covers all the dev modules and c...",16
Jira,Extremely good on workflow monitoring and handy reporting tools,N/A,JIRA does particularly well on tasks and activities tracking.It allows users to easily incorporate supporting documents with various formats.Easy monitoring and summarizing and is also flexible on assigning and commenting on a task.,"Sometimes the software is unresponsiveI also experiencing some bug occasionallyComments are viewed and order historically, hence it's difficult to have context if commenting on older comments","Extremely good on workflow monitoring and handy reporting toolsRating: 9 out of 10IncentivizedNovember 10, 2017Use Cases and Deployment ScopeJIRA is being used by multiple departments within IT group. We used it mainly for bug and defect tracking, we also use it to coordinate and communicate tasks w...",16
Jira,Great organization once figured out; very happy with them,N/A,"The breakdown from ""epics"" (very high-level ideas, goals) into ""stories"", ""tasks"", and ""sub tasks"" is not only a project manager's dream, but really helps keep the company informed about what general things are being worked on and ""how much more"" there is to getting something accomplished.Love the slack integration (keeping everyone posted on what just happened).",The boards (and which ones people are looking at / which tickets they pull or don't) can be a little confusing at time. That's really my only con.,"Great organization once figured out; very happy with themRating: 9 out of 10IncentivizedOctober 31, 2017Use Cases and Deployment ScopeIt's used within the dev team (and by VP Product) only for Organizing product/dev ideas, stories, and sprints.ProsThe breakdown from ""epics"" (very high-level ideas, g...",17
Jira,Judging JIRA Software,N/A,"It is a well-known and recognized issue tracking tool.It is extremely customizable, both in terms of customization of the tickets themselves as well as how one can apply workflows to manage your process.Given its wide usage in the market, there are a number of 3rd party plugins/integrations available for JIRA; you can tie it to your repository and have an integrated view of development within the issue tracking tool (for example).",,"Judging JIRA SoftwareRating: 6 out of 10IncentivizedOctober 26, 2017Use Cases and Deployment ScopeWe use JIRA as our primary development tool for bug tracking as well as for Agile process management. Combined with Confluence, nearly all of our SDLC is managed within JIRA and Confluence (the latter b...",17
Jira,JIRA is the only support tool for Atlassian Confluence users,N/A,,ultant in Engineering (1-10 employees),"JIRA is the only support tool for Atlassian Confluence usersRating: 4 out of 10IncentivizedOctober 24, 2017Use Cases and Deployment ScopeJIRA was used to document differences between a desired specification and a delivered prototype. The organization being small, it was used by everyone. It was inte...",17
Jira,Judging JIRA,N/A,Documented and rigid workflows.Automation where needed.High-level dashboards for management review.It is easy to use. This is evident by our high adoption rate.,"JIRA always has a snapshot of today, but it's hard to get trends.The marketplace has a lot of plugins, but most are not free. To build the best solution you may need to purchase several add-ons.Because it is very customizable you can end up with too many statuses or fields that mean the same thing. You need a good admin to help shepherd departments down the same path.","Judging JIRARating: 10 out of 10IncentivizedSeptember 27, 2017Use Cases and Deployment ScopeAlmost every department is using JIRA. It is keeping our teams focused and providing better visibility to team leads. It also allows for rigid workflows so steps are not missed.ProsDocumented and rigid workfl...",17
Jira,JIRA for Ops,N/A,Tracking multiple types of items under one roofNotificationsReports,"ultant in Information Technology (10,001+ employees)","JIRA for OpsRating: 7 out of 10IncentivizedSeptember 18, 2017Use Cases and Deployment ScopeJIRA is very useful to record and track requirements for small applications and records that we build. The tool is comprehensive, manageable, and provides good reporting. It also helps in tracking tasks and ti...",17
Jira,JIRA - I like it so much!,N/A,Defect trackingInstant e-mail notification to users - based on the role they play in the organizationWorkspace creation to help teams managing their work inside a bigger projects,Wish JIRA had more integration features with HipChat/other IMs used by businessesJIRA integration with HP ALM - this helps multiple teams using different test management tools within the same organizationMore intuitive burndown charts,"JIRA - I like it so much!Rating: 7 out of 10IncentivizedSeptember 7, 2017Use Cases and Deployment Scope<div>JIRA is used as a test management/tracking tool in our organization. It is being used across the whole organization</div><div></div>ProsDefect trackingInstant e-mail notification to users - ba...",17
Jira,JIRA for Agile is must,N/A,The best thing I liked about it were the variety of charts and graphs which helped us to have a clear understanding of our sprint work.The ability to create sub tasks for user stories.We can also customise or configure the application which helps us to keep the application as common as possible.The ability to prioritize the stories in the backlog so as to take it up in a sprint is also beneficial.,"I have nothing as of now which I dislike, will definitely update if I find any. We moved from another application to this, it has been better since then.","JIRA for Agile is mustRating: 7 out of 10IncentivizedAugust 10, 2017Use Cases and Deployment ScopeJIRA is used by our department here. It has helped us a lot. We work in a ScaleAgile mode hence it has helped us a lot in performing our Agile movement in our work. We have improved the way we work and ...",17
Jira,JIRA - The Best ALM Tool in the Market.,N/A,"Single view for all the user stories (active sprint/backlog)Ability to generate reports of various types for each of the active / closed sprints for e.g. burndown chart, sprint velocity etc.Ability to track release tickets - we can create tickets which are supposed to go for production from various sprints in one single page and manage it from there.Integration of communication tools like Hipchat and Slack makes it very easy for tracking & responding to notifications.","Complexity of integrating other ALM tools like TFS with JIRA - as my first project had to be migrated from TFS to JIRA, all the artifacts had to migrated manually into JIRA.Mobile app of JIRA is not so holistic in nature and one has to navigate a lot to do various things which are very easy to do in web application.","JIRA - The Best ALM Tool in the Market.Rating: 10 out of 10IncentivizedAugust 9, 2017Use Cases and Deployment ScopeJIRA is used in my organization for Application Lifecycle Maintenance (ALM) activities. It is used in collaboration with Confluence/Wiki for capturing detailed:1. User stories in form o...",17
Jira,JIRA modern tool for Project Management,N/A,Kanban provides a summary of all stories and status in a single view. Easy to track the iteration and easy to progress the stories. It's like a virtual agile wall.Integration with Git. We can see all the code changed for a particular story and defect fixes.Integration with Jenkins to progress the status of story.,"I like everything about this product,","JIRA modern tool for Project ManagementRating: 9 out of 10IncentivizedJune 23, 2017Use Cases and Deployment ScopeCurrently, we use JIRA in the IT department. It is very effective and efficient to manage our Agile projects. The task assignment, task progress, and workflow customization features are m...",17
Jira,A nice tool for big companies but it's better to find an alternative for small businesses.,N/A,"Inform people by email that they have a new task or replies to their comments.Clear interface.Nice tool to update information, modify or add [info]. You can also attach files up to 5 MB or more according to your settings.You can use the self-hosted version or use it on your own server.","It's hard to create new workflow schemes and apply them to some projects (not intuitive).If you want to hide tickets from people who are not concerned (add view restrictions), it's a pain. I had to contact support to set it up correctly.Pages loading are slow on the self-hosted version. It may due to sharing of resources across all customers.","A nice tool for big companies but it's better to find an alternative for small businesses.Rating: 7 out of 10IncentivizedMarch 30, 2017Use Cases and Deployment ScopeI use it only with website developers in order to describe what bugs need to be fixed, implement new features on current projects or to...",17
Jira,Very few issues with managing issues,N/A,"Creating dashboards for issue tracking and management.Highly customizable and many plugins are available.Logging, tracking and updating issues via email.",Useful for project management but not flexible enough to effectively use for other purposes.The search function is poor.Interface is not terribly user-friendly.,"Very few issues with managing issuesRating: 8 out of 10IncentivizedMarch 20, 2017Use Cases and Deployment ScopeJIRA is used by R&amp;D in order to work on adding features and improvements, as well as identifying and repairing bugs. JIRA is also used by engineering for working on server and data cent...",18
Jira,JIRA is the way to go for Agile development teams,N/A,Share information across development teamTrack progress of developmentManage Agile BoardsIntegration with Stash,Better use of time estimation regarding EpicsMore graphics optionsTimesheet functionality,"JIRA is the way to go for Agile development teamsRating: 9 out of 10IncentivizedMarch 7, 2017Use Cases and Deployment ScopeJIRA is being used across the whole organization as a bug and features tracking tool. We use the Agile boards a lot. During our sprints, we have each team assigned a board, wher...",18
Jira,My JIRA Experience,N/A,Shows you data on all the tasks you have going on like time estimated vs. logged vs. left to complete.Helps you prioritize tasks and assign to different developers.Can organize your tasks and projects into smaller chunks that are easier to understand.,Jira's graphs and charts are not super intuitive to set up to get sophisticated analyses on pain points in the project life cycle.Some features like filtering require a bit of tech savvy knowledge to use fully.,"My JIRA ExperienceRating: 6 out of 10IncentivizedFebruary 16, 2017Use Cases and Deployment ScopeWe use Jira to help prioritize projects in our development pipeline. We also keep track of work that is getting done and at what stage of the project that work is currently at. In particular, it helps sol...",18
Jira,Jira is the last software tool you'll need for Agile development,N/A,"JIRA helps the team share information and engage others seamlessly.Enables teams to work together with colleagues using joint-editing tools and monitoring the team’s progress and updates of each task.JIRA boasts a feature-rich service desk implementation that allows each department to collect customer requests instantly, and arrange them in priority queues that improve the productivity of the team and happiness of customers.","Jira is very good at helping us manage small, executable development tasks, but it does not meet the need of understanding the full scope of an “Epic” (big project).","Jira is the last software tool you'll need for Agile developmentRating: 7 out of 10IncentivizedDecember 5, 2016Use Cases and Deployment ScopeJIRA is being used by our department for agile development and bug tracking, specifically Scrum. It is being used throughout the organization and it really hel...",18
Jira,JIRA - For better productivity,N/A,Creating defects.Tracking defects.Organizing defect items and helping in triaging them effectively.,Integration with other similar tool suites like the IBM/Rational suite.,"JIRA - For better productivityRating: 8 out of 10IncentivizedNovember 18, 2016Use Cases and Deployment ScopeWe use JIRA for defect management and triaging.ProsCreating defects.Tracking defects.Organizing defect items and helping in triaging them effectively.ConsIntegration with other similar tool su...",18
Jira,Jira: Swiss Army Knife of Agile Sprint tools.,N/A,,Jira could provide a Favorites list of recently used gadget/filter combinations when creating a new dashboard.Jira could provide a url link to Atlassian forums or Jira blogs that updates when opening the application.Jira could provide a history drop in the quick search field of the Plan view to help find that hidden story or bug quickly.,"Jira: Swiss Army Knife of Agile Sprint tools.Rating: 9 out of 10IncentivizedNovember 3, 2016Use Cases and Deployment ScopeWe are using Jira across our agile office's sprint teams. Jira provides a collaboration model and workflow for developers, QA testers, and architects. Jira addresses our business...",18
Jira,"JIRA - Love at First Site for Developers, a Slow Courtship for Business",N/A,,,"JIRA - Love at First Site for Developers, a Slow Courtship for BusinessRating: 8 out of 10IncentivizedSeptember 20, 2016Use Cases and Deployment ScopeThe use of JIRA is company-wide but sporadically. JIRA is viewed as an ""opt-in"" tool in our organization and is mainly sought by the development group...",18
Jira,JIRA - The Godzilla of bug tracking softwares,N/A,,The permissions for users are pretty hard to navigate through. The permissions controls are not user friendly and easy to understand or implement.There need to be more gadgets added to the Dashboard feature to make it more diverse and useful. Especially a text gadget should be a default option available and not an add on.There is no way to effectively sort tickets linked to one ticket.,"JIRA - The Godzilla of bug tracking softwaresRating: 7 out of 10IncentivizedAugust 2, 2016Use Cases and Deployment ScopeJIRA is the main bug-tracking/requirement software used by my company. QA uses it to document bugs and keep track of the progress of a project. They also use it to report results t...",18
Jira,Powerful and flexible - but not for the faint of heart!,N/A,"Highly customisableConstantly being updated and improvedFlexible in terms of being able to adapt it to a number of different scenarios, e.g. Agile Project, Support Project, Issue Log, etc.It's relatively simple to use once configured by an expert","Sometimes it appears overly complex, like it's trying to be all things to all teams - this can put some users offIt was never built from the ground up as an agile software development took like Mingle or Target Process, sometimes this shows.","Powerful and flexible - but not for the faint of heart!Rating: 9 out of 10IncentivizedAugust 1, 2016Use Cases and Deployment ScopeIt is used by our delivery, creative and technical teams.It addresses the need for contextual commenting and feedback on user stories and bugs. It also is used to plan sp...",18
Jira,"A Mainstream Choice for Project Management, not a Product Management Tool",N/A,"Jira's Kanban boards are easy to use and customize.The option to write your own queries gives you lots of flexibility for how your organize and display the workflow.Jira itself has a lot of traction in the market, so it integrates with a lots of other tools.",,"A Mainstream Choice for Project Management, not a Product Management ToolRating: 6 out of 10IncentivizedAugust 1, 2016Use Cases and Deployment ScopeWe use Jira to manage projects and support tickets in Engineering. It has touch points with Product Management, Customer Success, and Research, but it's...",18
Jira,JIRA is a Japanese word (gojira),N/A,Organizes queues wellEasy to learnLinks with other software tools like SmartsheetCustomizable,"A lot of manual entry in the beginning but administrators can create templatesSince it's cloud based, we experienced a lot of system failures where we couldn't access informationCould be very slow depending on connectivity issues","JIRA is a Japanese word (gojira)Rating: 9 out of 10IncentivizedJuly 29, 2016Use Cases and Deployment ScopeJIRA was used to track the production cycle of thousands of internal digital products and requests. It was linked with SmartSheet for easy access to our internal database and helped with visibil...",19
Jira,Jira is great for what it's good at!,N/A,"Tracking hierarchy and linking for Epics -&gt; Stories -&gt; Defects.Linking stories in one team's Jira project to another project, due to dependencies needed for enterprise software development.Flexibility in set up and workflows can vary by team, and can be customized by that team.","I'd love to be able to customize further what types of data shows in different views (e.g. Backlog vs. Agile Board).I'd like to see more data in the links between stories, as well, so that you can see more info without having to link out to the other story and view.","Jira is great for what it's good at!Rating: 9 out of 10IncentivizedJuly 29, 2016Use Cases and Deployment ScopeAcross all software development teams, we use Jira for work including: defects, stories, epics, dependency mapping, etc. Each team has their own Jira project and their own boards (Agile boar...",19
Jira,JIRA Software review,N/A,JIRA is a very good planning tool.JIRA is a very good issues reporting tool.,For me it's pretty convenient.,"JIRA Software reviewRating: 10 out of 10IncentivizedJuly 22, 2016Use Cases and Deployment ScopeSince the company I belong to is working on Agile, JIRA is used for the following purposes:1. Create tasks, epics, stores and requirements for different projects.2. Reports issues.3. Create deployment tick...",19
Jira,Getting projects done fast,N/A,Time trackingProject/task setupGit integration,Confusing interface. They need to clean up the interface a bit.,"Getting projects done fastRating: 7 out of 10IncentivizedJuly 20, 2016Use Cases and Deployment ScopeI used JIRA Software for a client organization in 2015 to manage various tasks across projects. It's useful in managing git commits and keeping everyone in the loop as far as what needs to be done in ...",19
