product_name,review_title,rating,pros,cons,full_content,page_number
Jira,Manage your projects with a simple and easy to use interface,N/A,"It is very simple, basic and simple to use.It allows precise customizable estimates according to the needs of the project.You can have administrative control of the company's activities (projects, processes, procedures).It is compatible in virtually all databases.It offers Web access with support for the main browsers in the market, email notifications, as well as many applications that provide additional resources to Jira.","Although Jira is an excellent tool for project management, the cost can be somewhat expensive.Its initial configuration proved to be complicated.It can be difficult for beginners, because it is difficult to understand its characteristics.","Manage your projects with a simple and easy to use interfaceRating: 9 out of 10IncentivizedAugust 17, 2019Use Cases and Deployment ScopeIt is being used throughout our organization. We use it to plan, monitor and develop your projects quickly and easily. With Jira, plan your daily work by creating u...",12
Jira,JIRA works,N/A,Project trackingIndividual task trackingIntegration with Github,Communication with team members is adequate but not as good as other softwareNot as many software integrations as I would likeCan't delete tasks unless you are super user,"JIRA worksRating: 8 out of 10IncentivizedAugust 14, 2019Use Cases and Deployment ScopeJIRA Software is used by the website development group. It tracks our new projects, our system bugs, and system problems. We use it to communicate with our workers who are off-site. We also use JIRA with Github to ...",12
Jira,JIRA for an easy kickstart,N/A,,"The processes can not be thoroughly analyzed, visualized and managed. Although a basic reporting is available and reports can be customized, the process discovery in a complex environment is not supported. This can, however, be provided by an external process mining application. JIRA can export the data or provides access to its database via API.","JIRA for an easy kickstartRating: 10 out of 10IncentivizedAugust 13, 2019Use Cases and Deployment ScopeI have experienced JIRA in two major areas:1 ) a tool supporting internal users or client requests (internal or external service desk/help desk).2) a teamworking tool for the sharing of software sp...",12
Jira,The winning combination for your software development team: JIRA + Agile,N/A,Easy to use bug tracking features.It has a great support for Agile SCRUM and Kanban software development methodologies.Promotes collaboration within the team and across teams.It is extremely configurable and allows a system admin to address complex project management requirements.,,"The winning combination for your software development team: JIRA + AgileRating: 10 out of 10IncentivizedAugust 12, 2019Use Cases and Deployment ScopeWe use JIRA as a project management and a bug tracking tool for most of the company projects. Whether it is software development, ASIC design or IP dev...",12
Jira,JIRA is a great project management tool,N/A,Easily manage workload.Get all useful information and links to useful documents.Check the status of a project.Integration with Git.,There is no code refactoring plugin.We can prioritize the projects.The user interface makes it a bit complex to search for all items.,"JIRA is a great project management toolRating: 9 out of 10IncentivizedAugust 12, 2019Use Cases and Deployment ScopeJIRA is being used in our organization to manage software development. It is used to easily manage the workload. It makes our developer's job easier as they can get all the information ...",12
Jira,Get agile with JIRA Software,N/A,,,"Get agile with JIRA SoftwareRating: 9 out of 10IncentivizedAugust 12, 2019Use Cases and Deployment ScopeMultiple teams within our organization use JIRA Software, including Product Content Strategy, Product Design, Product Education, Product Research, Front End, and Dashboard. Each team uses JIRA a b...",13
Jira,JIRA is the most easy to use project management software out there,N/A,It is a great tool to link documents and documentation to specific user stories to keep things organized.It has a great user management feature to help us plug resources into the right projects and remove users as they move on to other work.It has sold plug-and-play options that you can elect to use or deselect in order not to cloud the interface.,"The look and feel is a bit sterile, which is both good and bad. Some nice skins to make it easily customizable to our existing corporate color schemes would be nice.Cost is always a place for improvement. JIRA is not overly expensive, but in a market where there are a ton of options, price is a negotiation point.Better integrations with vendor/partners using the same tool would help onboard offshore resources we occasionally use.","JIRA is the most easy to use project management software out thereRating: 10 out of 10IncentivizedAugust 10, 2019Use Cases and Deployment ScopeWe use JIRA to manage multiple high-levelprojects within our company. It is a corporate-wide engagement with JIRAwith several businesses that use it independ...",13
Jira,JIRA - adapts to your software development process!,N/A,Custom search queries can be saved and shared as filters.Batch operations on tickets work well and you can choose if you want to notify others.Ticket fields are highly customizable for easier creation.,"Some operations take their time.Default ticket settings are too complicated and complex for simple use cases.Basically, there is no ""one go to process"". You can pick Kanban, Scrum, ... whatever you like. The user interface, therefore, looks quite mixed up on some occasions.","JIRA - adapts to your software development process!Rating: 10 out of 10IncentivizedJuly 15, 2019Use Cases and Deployment ScopeJIRA has been a great replacement for Microsoft Team Foundation Server. Not only is it easier to use, but it's highly customizable by our organization without the need of ext...",13
Jira,JIRA -- The all in one cost-effective and integrated project management solution for our Organization,N/A,"Bug life cycle management.Grouping of deliverables as: epic, story, change request, bugs, tickets, enquiries, etc.Logging estimates and tracking actual efforts, giving effective variance computation.Computing metrics for our projects using the custom fields in JIRA.","The SLA management is ineffective.The assignee has to be an individual, which is a restriction. JIRA needs to enable issue assignment to a group/department as well, to bring it to an issue dashboard.Query management can be made easy with some add-ons like 'Script runner' which is currently outside JIRA.","JIRA -- The all in one cost-effective and integrated project management solution for our OrganizationRating: 10 out of 10IncentivizedMay 29, 2019Use Cases and Deployment ScopeJIRA is used in my organization for tracking issues from production support by our support team. For customer delivery and pl...",13
Jira,All around change management tool with lots of features,N/A,Agile development with sprint boards.Versatile filtering and customization of projects and reports.Easy and simple user interface.,Filters could be more descriptive.Could be integrated with requirement management software for direct navigation.More 3rd party add-ons could be better.,"All around change management tool with lots of featuresRating: 9 out of 10IncentivizedMay 29, 2019Use Cases and Deployment ScopeProject and change management with issue tracking is crucial for safety-critical software development in aerospace industries. JIRA provides many of the project management ...",13
Jira,A Project Management tool for your organization and clients,N/A,TasksProject managementAgile boardsTicketing for problems etc.Complex user management.,User management can be to complex for non-trained users.Very expensive.Could services sometimes crash?,"A Project Management tool for your organization and clientsRating: 8 out of 10IncentivizedMay 4, 2019Use Cases and Deployment ScopeWe're using Jira as a tool to be in control of our projects. We use it for tasks and much more. We use it across all of our organization and highly appreciate the option...",13
Jira,Jira PM review,N/A,Flexible in building interfaces for different teamsPowerful archive provides historical data for past projects in case they need to be retrievedLinks to different software to easily load information and build tickets faster,"Interface is outdated and not easy to use, which makes it slower to work with the toolTicket linking is not very flexible, so it's not easy to reference work to other department work in progress or pastOverall system is very technical, making it challenging for more non-technical teams to join and use the tools","Jira PM reviewRating: 6 out of 10IncentivizedApril 9, 2019Use Cases and Deployment ScopeJira project management system is used to manage project tickets. It's used across departments, and helps prioritize work.ProsFlexible in building interfaces for different teamsPowerful archive provides historica...",13
Jira,JIRA is the BEST software collaboration tool,N/A,An effective tool for planning/tracking work from project backlogs and SprintAn effective tool for tracking defectsFully customizable Kanban and Scrum boardsEasy to maintain the integration of defects and test using a test management tool like QAComplete.,"JIRA is fully customizable, although we were able to make our QA process fit into JIRA's workflow, it is not designed to work like this. Not easy to make it work as a test management tool.","JIRA is the BEST software collaboration toolRating: 9 out of 10IncentivizedMarch 14, 2019Use Cases and Deployment ScopeWe use JIRA as our company's main project management tool, this integrates development and QA to plan, track and report progress of our software releases.ProsAn effective tool for p...",13
Jira,JIRA and Agile for you business,N/A,,"The UI is a bit confusing sometimes to the inexperienced user.The price can be a little too much for small businesses.Too many features, that sometimes can bring some complexity to the platform (this is sometimes rated as a good area too, it will depend on how experienced [you are] and the points you want to cover with this tool).","JIRA and Agile for you businessRating: 9 out of 10IncentivizedMarch 3, 2019Use Cases and Deployment ScopeWe use JIRA to manage/track projects across the whole organization. It is a well documented tool and helps our team members to keep up with the workload as well as generate KPIs to higher managem...",13
Jira,"Jira = collaboration, integration, usability.",N/A,"Tracking projects based on assignee (ie: the person who needs to take action on a ticket).Easily seeing how many product tickets are open at any given time.Planning and road mapping of your product, Jira makes it very easy to track priority with development effort, you can display it easily on a map.","I'd like to see merge fields be slightly easier to use, but you can still format everything really nicely in comments, so it isn't a big problem.","Jira = collaboration, integration, usability.Rating: 10 out of 10IncentivizedFebruary 23, 2019Use Cases and Deployment ScopeJira, at a high level, is being used by our technical teams (engineering, support, implementation) to track development efforts, product feedback from our clients, as well as D...",13
Jira,Usage of JIRA by our geographically distributed Agile software development team,N/A,When you want a configurable workflow for different issue typesShowing the entire sprint progress at a glance in the burndown (or burnup) chartEnsuring every team member (even a new one) knows the steps that an issue has to take before closure,"Workflows and schemas are sometimes really difficult to understand. You learn it one time and it works fine for 6-7 months. When you need to modify it, it seems you need to learn it ALL OVER again.Left hand navigation panels sometimes need to be collapsed and expanded multiple times.","Usage of JIRA by our geographically distributed Agile software development teamRating: 10 out of 10IncentivizedNovember 26, 2018Use Cases and Deployment ScopeJIRA is used by the entire BizMerlin team for design and development of the product roadmap. Product managers add items to the backlog as well...",14
Jira,JIRA - Development workflow for all companies...,N/A,Great tool for agile developmentAllows flexibility to build out workflows that map to your company's internal processesFlexibly reporting and build out by team,Make certain the full end to end processes are documented - changing flows will impact the lineage of your dataMake certain someone on the team has JIRA experience or have a vendor support you in the implementationLook at full functions offered out of the box and understand additional plug-ins that may be needed.,"JIRA - Development workflow for all companies...Rating: 9 out of 10IncentivizedNovember 1, 2018Use Cases and Deployment ScopeJIRA is being used as an overall tracking tool for application development. Requests for new enhancements/projects may be placed in the system or defects may be tracked. IT ma...",14
Jira,JIRA Software: A great platform for sprint planning and issue tracking,N/A,JIRA is great for tracking issuesIt allows for excellent communication with other JIRA usersIt's easy to search and navigate the platformAdministration of JIRA is very easy and straightforwardDocumentation is generally pretty good as is JIRA support,Sometimes the documentation is a bit tricky to find depending on what version you're runningTroubleshooting complex issues when you use multiple plugins can be difficult,"JIRA Software: A great platform for sprint planning and issue trackingRating: 9 out of 10IncentivizedSeptember 7, 2018Use Cases and Deployment ScopeJIRA is being used across the organization by a wide array of users. We use it for issue tracking and sprints as well as as a product pipeline. It allow...",14
Jira,JIRA ALM is one of the best ALM tools available in the market.,N/A,The defect management and tracking mechanism is one of best in the industry.,The cost for the software licensing could be improved upon.,"JIRA ALM is one of the best ALM tools available in the market.Rating: 8 out of 10IncentivizedAugust 17, 2018Use Cases and Deployment ScopeJIRA ALM is one of best ALMs available in the market today. The rating for the overall user interface would be 4/5. Mainly because of it's seamless depiction of a...",14
Jira,JIRA-Easy to track,N/A,Managing workflow is too good.,Miscalculates the pending minutes some times.,"JIRA-Easy to trackRating: 10 out of 10IncentivizedJuly 16, 2018Use Cases and Deployment ScopeThe complete organization uses JIRA to track the issues or create user stories for developers.ProsManaging workflow is too good.ConsMiscalculates the pending minutes some times.Likelihood to RecommendIt is e...",14
Jira,Jira make software development tracking easier,N/A,Easy to drag and drop issues to statusUI is very good and easy to follow the sprint progressDashboard features are good,"Issue detail view can be a little limited, would like more room to configureChange the status of issue in all issue viewsIncreased functionality on dashboards, allow text field boxes","Jira make software development tracking easierRating: 10 out of 10IncentivizedJuly 13, 2018Use Cases and Deployment ScopeJira is used primarily by IT department as our software development tool for tracking all work. Recently our marketing and claims department has started to use it as well. We also...",14
Jira,"Kind of a must-have tool for working on bugs, engineering problems, etc.",N/A,"Great for engineers to track issues, bugs, problems, etc.Helpful for collaboration on bugs and great for managing sprints.","Definitely not the prettiest or most intuitive interface. Very much feels like it was built by an engineer.My biggest annoyance is that I get emails for updates to a bug's comments far too frequently. As in, someone will be editing a task and I'll get 5 emails in the course of them simply typing something out or making updates to the task. These things should be aggregated and there should be a time delay on when the emails reach me.","Kind of a must-have tool for working on bugs, engineering problems, etc.Rating: 8 out of 10IncentivizedJuly 13, 2018Use Cases and Deployment ScopeWe use JIRA to track and manage all bugs and tasks relating to the engineering teams in the company.ProsGreat for engineers to track issues, bugs, problem...",14
Jira,All-in-one project tracking platform,N/A,"I personally like the ability to track where issues and task are, how much work has been completed on them and what the estimated time remaining is.Easy to interact with a task. Easy to get into the task for the bug fixes and report it to the higher level through the spontaneous notifications.I like how JIRA helps teams organize themselves.",I can't say anything that bothers me about JIRA.The price is little bit high.,"All-in-one project tracking platformRating: 9 out of 10IncentivizedJune 18, 2018Use Cases and Deployment ScopeLogging and tracking issues in the project. I also use it as a way of noting down ideas as they arise. I don't have time to do most things as they are thought of so it is great for logging f...",14
Jira,JIRA - Managing a Project Activity at your Fingertips!,N/A,Manages Epics (projects) very well. Tasks can be adjusted easily along with their corresponding Story Points. The Backlog can be easily managed by moving Tasks around as needed.Notifications can be automatically sent out (if setup) to the Developer when new work is assigned.Epics/Tasks/backlog items can be managed through an easy to use drag and drop process.Agile. Easy to work with (very intuitive),"I don't have anything negative to say about the software.As with any software, the GUI can always use improvement, but that comes with time.It can lock up very briefly at times due to too many users.","JIRA - Managing a Project Activity at your Fingertips!Rating: 10 out of 10IncentivizedMay 28, 2018Use Cases and Deployment ScopeJIRA is used by our Company to setup Epics and the associated Tasks that belong with the Epic. We then plan our Sprint (2 weeks) with Development tasks and track the progre...",14
Jira,JIRA is the ultimate in issue tracking software,N/A,"Customized workflows - JIRA can be set up to work for any imaginable workflow.Fine grained account control - roles can be created for any type of user access, giving you full control.Nice looking and easy to use UI.Available in SaaS and self hosted.","It can be overwhelming. So many configurations and options can make it difficult to manage.It's among the most expensive in its category. Much cheaper options are available and likely do what you need.If your admin configures things wrong, it can be very difficult to use as a user.","JIRA is the ultimate in issue tracking softwareRating: 8 out of 10IncentivizedMay 23, 2018Use Cases and Deployment ScopeWe use JIRA as a project management tool. We use it to manage our backlog of tasks, plan our sprints and organize who works on what. We use their reporting to get metrics on how we...",14
Jira,Great for any project that requires collaboration between developers and product managers,N/A,Highly customizableDynamicGood integration with a variety of other products,"ultant in Marketing (10,001+ employees)","Great for any project that requires collaboration between developers and product managersRating: 7 out of 10IncentivizedMay 17, 2018Use Cases and Deployment ScopeJIRA is used for small pilot tests that require rapid iteration on software projects.ProsHighly customizableDynamicGood integration with a...",15
Jira,The Tool for you development,N/A,ConfigurableUser friendlyCost for small teams,Too many options. Sometimes a configuration has too many steps to be done.Cost to medium teamsA large server footprint to local servers (Tomcat is a large memory user),"The Tool for you developmentRating: 10 out of 10IncentivizedMay 14, 2018Use Cases and Deployment ScopeWe use Jira to manage all our user stories, all development content, and actions. With this tool, we no longer forget anything in our development cycle.ProsConfigurableUser friendlyCost for small te...",15
Jira,Solid Organizational Tool,N/A,Easy and efficient way to organize and assign workAllows for the creation of a hierarchy of tickets and work to keep priorities organizedUser-friendly and cost efficient as an organizational toolTraining resources readily available,"ultant in Corporate (10,001+ employees)","Solid Organizational ToolRating: 8 out of 10IncentivizedApril 25, 2018Use Cases and Deployment ScopeJIRA software is currently being used within our department as an organizational tool. JIRA is being used intermittently across the whole organization, but is not currently a standard. JIRA really hel...",15
Jira,Heavy-duty issue tracker,N/A,Highly customizableComprehensive workflowsGranular notificationsClear UI,On-demand version is often very slow,"Heavy-duty issue trackerRating: 8 out of 10IncentivizedApril 6, 2018Use Cases and Deployment ScopeWe use JIRA across all departments, including marketing or customer success. Development teams use Scrum capabilities (sprints, etc.), while the rest of the organization typically uses Kanban boards.Pro...",15
Jira,"Integrated, Reliable And Very Customizable.",N/A,Custom fields.Define several workflows.Collaboration between teams.,UI/UX lacks.Performance issues.,"Integrated, Reliable And Very Customizable.Rating: 8 out of 10IncentivizedMarch 28, 2018Use Cases and Deployment ScopeThe applications are hosted in the cloud. This means you don't have to worry about buying and maintaining your own infrastructure. The service's very reliable, affordable, allow us t...",15
Jira,My day to day with JIRA!,N/A,"It is excellent for the control of development projects under agile methodology.It allows you to reprogram issues, attach images, set subtask to each issue, which later depending on the complexity you can convert into an issue to execute later.By closing each sprint you can graphically view the Burndown Chart, which allows you to analyze with the development group, if the sprint was under what was planned or what caused the deviations.",Coordinador de desarrollo de software in Research & Development at Ingeniería de ulta Incostas (51-200 employees),"My day to day with JIRA!Rating: 10 out of 10IncentivizedMarch 12, 2018Use Cases and Deployment Scope<p>In the software development department of the company, we control projects under the agile methodology. We manage all the development and maintenance projects of our internal applications using JIR...",15
Jira,Jira- Effective Tool to manage Agile Teams,N/A,,"Enterprise Agile Coach in Information Technology at Tata ultancy Services (10,001+ employees)","Jira- Effective Tool to manage Agile TeamsRating: 8 out of 10IncentivizedFebruary 23, 2018Use Cases and Deployment ScopeIt is being used at a program level in the organisation. We use JIRA to track our Agile teams that are [composed] of Scrum and Kanban teams. We use it for tracking epics, stories, ...",15
Jira,It’s okay overall but needs some work,N/A,They return your calls (usually)Creates helpdesk tickets per issueThey usually follow upCan connect to users using interface easilySoftware tracks specific IT support person assisting customer,They don’t always know the real issue and spend too much time figuring out the wrong solutionSometimes they pass around the issue for days.They need to understand all software programs well.Multiple attempts needed to bypass admin access,"It’s okay overall but needs some workRating: 3 out of 10IncentivizedFebruary 23, 2018Use Cases and Deployment ScopeIt’s being used all across our organization. It addresses IT related issues and is a direct line to assist all workers.ProsThey return your calls (usually)Creates helpdesk tickets per i...",15
Jira,Jira Review,N/A,Task Management - Keep Track of TasksPriority Management - Prioritize TasksReporting - Create Reports That YOU Need,Customization - Better customization for specific needsEase of Access - More training or helpful tips within the program,"Jira ReviewRating: 9 out of 10IncentivizedFebruary 13, 2018Use Cases and Deployment ScopeMy organization (about 45 people) is currently either using Jira or is considering the use of Jira to manage tasks and keep a record of past, present, and current projects. Jira provides us a means to better mon...",15
Jira,JIRA is a very useful tool,N/A,"Organization and prioritization of workThe ability to customize (forms, workflows, etc.)The ability to share information easily (adding attachments, adding ""watchers"" to issues, as well as integrations with other products)",,"JIRA is a very useful toolRating: 8 out of 10IncentivizedFebruary 2, 2018Use Cases and Deployment ScopeOur product team uses JIRA to communicate with developers and manage sprints using the Sprint boards. The commercial support team also uses the help desk feature and other tech teams use Kanban boa...",15
